{
  "$schema": "http://json-schema.org/draft-07/schema#",
  "title": "Category Quality Rubric",
  "type": "object",
  "required": ["module", "version", "system_module", "criteria"],
  "properties": {
    "module": { "type": "string" },
    "version": { "type": "string" },
    "date": { "type": "string" },
    "system_module": { "type": "string" },
    "criteria": {
      "type": "array",
      "minItems": 1,
      "items": {
        "type": "object",
        "required": ["id", "order_index", "tier", "statement", "above_generic_rationale", "grading", "evidence_required", "concrete_fix"],
        "properties": {
          "id": { "type": "string" },
          "order_index": { "type": "number" },
          "tier": { "type": "string", "enum": ["baseline", "good", "exceptional"] },
          "system_module": { "type": "string" },
          "statement": { "type": "string" },
          "above_generic_rationale": { "type": "string" },
          "grading": {
            "type": "object",
            "required": ["pass", "partial", "fail"],
            "properties": {
              "pass": { "type": "string" },
              "partial": { "type": "string" },
              "fail": { "type": "string" }
            }
          },
          "evidence_required": { "type": "string" },
          "concrete_fix": { "type": "string" },
          "exemplar_refs": { "type": "array", "items": { "type": "string" } },
          "provenance": {
            "type": "object",
            "properties": {
              "sources": { "type": "array", "items": { "type": "string" } },
              "confidence": { "type": "string" }
            }
          }
        }
      }
    },
    "judge": { "type": "object" },
    "backtest": { "type": "object" },
    "scoring_bias": { "type": "object" },
    "provenance": { "type": "object" }
  }
}
