{
  "module": "combat",
  "version": "1.0",
  "system_module": "combat",
  "criteria": [
    {
      "id": "marker-driven-event-timing",
      "order_index": 1,
      "tier": "baseline",
      "system_module": "combat",
      "statement": "All combat gameplay events (hitbox activation, cancel windows, recovery start, VFX/SFX/hitstop triggers) are driven off named animation event markers via AnimationTrack:GetMarkerReachedSignal — NOT off wait()/task.delay timers or track.Length math. A non-programmer can move the impact frame in the editor and the gameplay re-syncs with zero code change.",
      "above_generic_rationale": "Surface check would be 'damage fires at the right time.' The systems-depth check is the DECOUPLING mechanism: hardcoded delays (wait(0.3)) drift with frame rate, AdjustSpeed, and replacement animations, visibly disconnecting hit from swing. Verifying markers (not timers) tests whether timing is structurally bound to the visual, which is the spine that lets every other feedback channel fire on one synchronized frame. The first play of an animation also reports Length 0, silently breaking length-based gating — markers sidestep this entirely.",
      "evidence_required": "Scripts use GetMarkerReachedSignal('HitFrame'/'CancelOpen'/'RecoveryStart') with named markers placed in the animation editor timeline; grep shows NO wait()/task.delay/task.wait(track.Length...) gating attack logic. Markers optionally carry a Parameter string.",
      "concrete_fix": "Replace task.wait(0.3) damage delays with track:GetMarkerReachedSignal('HitFrame'):Connect(...) and place a 'HitFrame' marker at the contact keyframe in the editor.",
      "grading": {
        "pass": "Attack timing (hitbox, cancel window, recovery, FX) is gated by named animation markers consumed via GetMarkerReachedSignal; a grep finds no wait()/task.delay/track.Length math driving the attack logic; moving the marker in the editor re-syncs gameplay with no code change.",
        "partial": "Markers are used for SOME events (e.g. hitbox) but other timing-critical events (cancel window or FX) still rely on wait()/task.delay or track.Length math; or markers exist but a length-based gate remains that breaks on first play (Length==0).",
        "fail": "Attack events are gated by wait()/task.delay/task.wait(track.Length...) timers rather than animation markers, so timing drifts with frame rate/AdjustSpeed and the hit decouples from the swing."
      },
      "provenance": {
        "confidence": "high",
        "sources": [
          "https://raw.githubusercontent.com/Roblox/creator-docs/main/content/en-us/animation/events.md",
          "https://kitsblox.com/blog/how-to-make-combat-system-roblox",
          "https://www.youtube.com/watch?v=gxYSxENGp-E",
          "https://simplified.media/guides/roblox-combat-systems"
        ]
      }
    },
    {
      "id": "swept-active-frame-hitbox-no-touched",
      "order_index": 2,
      "tier": "baseline",
      "system_module": "combat",
      "statement": "Hit detection is committed to an ACTIVE-FRAME model, not a swing-wide or .Touched model. The discriminating commitment, stated at the description level, is that the damage volume is LIVE ONLY during a narrow contact window inside the swing (gated by the same active-frame timing that drives FX) and DEAD during windup and recovery — NOT a volume that is 'active for the whole swing' and NOT BasePart.Touched. Above that floor, depth is shown by: a SWEPT spatial query that samples the weapon path between the previous and current frame (raycast/shapecast along the blade, or GetPartsInPart/GetPartBoundsInBox with OverlapParams) so fast swings cannot tunnel past thin targets, plus a per-swing already-hit set keyed by humanoid so each target takes exactly one hit per swing. A build whose hitbox is whole-swing-wide, instantaneous, or .Touched-based FAILS even if it deals damage; merely narrowing the window without swept sampling or dedup is PARTIAL.",
      "above_generic_rationale": "The mean artifact explicitly states the hitbox is 'active for the whole swing (no marker-synced active frames)' — a windup-and-recovery-wide volume — while the great artifact explicitly claims 'active frames driving hitboxes'. The original criterion's PASS evidence (swept query type, OverlapParams, hitList guard) is invisible in prose, so BOTH collapsed to fail and the criterion gave zero separation. Re-anchoring the discriminating axis on the active-frame-window COMMITMENT (which the great prose affirms and the mean prose explicitly rejects) lets the great artifact clear FAIL while the mean cannot, and preserves swept-sampling + dedup as the higher PASS bar so the ceiling stays at true systems depth rather than 'damage happens'.",
      "evidence_required": "Description commits the hitbox to a narrow active-contact window (live only during the strike, dead in windup/recovery), NOT whole-swing and NOT .Touched. For full marks: swept-path sampling between last/current positions (raycast/shapecast/GetPartsInPart/GetPartBoundsInBox) defeating tunneling, plus a per-swing humanoid-keyed hit-set guaranteeing one hit per target per swing.",
      "concrete_fix": "State that the damage volume activates only on the contact window (not the whole swing), sample the swept weapon path between frames with GetPartBoundsInBox/shapecast rather than .Touched, and add a per-swing hitList[humanoid] dedup so each target is hit once.",
      "grading": {
        "pass": "The hitbox is committed to a narrow active-contact window (live only during the strike, dead during windup/recovery), uses a swept spatial query sampling the weapon path between last and current frame positions (no .Touched), and has a per-swing humanoid-keyed hit-set so each target takes exactly one hit per swing.",
        "partial": "The description commits to active-frame windowing (not whole-swing, not .Touched) but is missing swept-path sampling (fast swings can tunnel) or the per-swing dedup set (one swing can multi-hit a rig).",
        "fail": "The hitbox is whole-swing-wide / instantaneous / windup-and-recovery-active, or uses BasePart.Touched, or has no contact-window commitment at all — damage is dealt but the active-frame model is absent."
      },
      "provenance": {
        "confidence": "high",
        "sources": [
          "https://github.com/Swordphin/raycastHitboxRbxl",
          "https://devforum.roblox.com/t/shapecasthitbox-for-all-your-melee-needs-v025/3624241",
          "https://devforum.roblox.com/t/creating-a-battlegrounds-like-hitbox/3623640",
          "https://devforum.roblox.com/t/how-do-i-make-my-hitboxes-better/4342115",
          "https://www.youtube.com/watch?v=gxYSxENGp-E",
          "https://www.youtube.com/watch?v=XAO3HF4vFg0",
          "https://devforum.roblox.com/t/the-basics-of-combat-games-hitboxes/3002930"
        ]
      },
      "change_reason": "Original failed to discriminate: its load-bearing evidence (GetPartsInPart vs Raycast, hitList table) is structural code detail absent from any prose artifact, so the great artifact's genuine 'active frames driving hitboxes' claim scored identically (fail) to the mean's explicit 'active for the whole swing'. Rewrite moves the PASS/FAIL boundary onto the active-frame-WINDOW commitment — the exact systems distinction the great prose makes and the mean prose negates — while keeping swept-path sampling and per-swing dedup as the PARTIAL→PASS ceiling."
    },
    {
      "id": "layered-impact-sound-on-contact",
      "order_index": 3,
      "tier": "baseline",
      "system_module": "combat",
      "statement": "Impact audio is layered and role-aware (whoosh on the swing, distinct thud/crunch/clang on connect, recognizable consistent parry/block cue) and the CONNECT sound fires on the contact-frame marker — not on swing start. Consistent interactions produce consistent, recognizable sounds.",
      "above_generic_rationale": "Surface check is 'there is a hit sound.' The depth check is WHEN it fires and whether it is layered: a connect sound played at swing-start (or a single undifferentiated clip) is the fastest tell of a generic system. Syncing the connect layer to the same contact marker as the hitbox, and keeping interaction sounds consistent so players learn them, is what makes hits read as decisive rather than mushy.",
      "evidence_required": "Separate swing-whoosh and connect-thud assets; connect sound triggered from the HitFrame marker (same frame as hitbox), not at Activated/swing-start; a dedicated consistent parry/block sound exists; transient sounds parented to victim HRP with capped RollOffDistance.",
      "concrete_fix": "Move the connect SoundService:PlayLocalSound/sound:Play call out of the swing-start handler into the HitFrame marker callback, and add a separate whoosh on the swing track.",
      "grading": {
        "pass": "Audio is layered (distinct swing-whoosh and connect-thud assets, plus a dedicated consistent parry/block cue) and the connect sound fires from the HitFrame contact marker, not at swing-start; consistent interactions produce consistent recognizable sounds.",
        "partial": "Distinct hit and swing sounds exist but the connect sound fires at swing-start rather than the contact marker; or sounds are layered but there is no dedicated/consistent parry-block cue.",
        "fail": "A single undifferentiated hit clip plays (no whoosh/connect separation) or the hit sound fires on swing-start instead of contact, so hits read as mushy and generic."
      },
      "provenance": {
        "confidence": "high",
        "sources": [
          "https://devforum.roblox.com/t/feedback-on-melee-combat-system/2271534",
          "https://devforum.roblox.com/t/creating-a-battlegrounds-like-hitbox/3623640",
          "https://www.wayline.io/blog/level-up-indie-game-melee-combat",
          "https://www.youtube.com/watch?v=Ht6ZfibXpDs"
        ]
      }
    },
    {
      "id": "animation-priority-layering-coexist",